{"notion_import_manifest_id":"notion-import-demo-0001","schema_version":"1.0.0","tenant_id":"tenant-demo","project_id":"project-demo","export_id":"delivery-export-demo-0002","delivery_package_id":"delivery-package-demo-0002","integration_mode":"manual_import","source_snapshot_revision":9,"source_records":[{"tenant_id":"tenant-demo","project_id":"project-demo","source_record_id":"project-demo","source_sha256":"aaaaaaaaaaaaaaaaaaaaaaaaaaaaaaaaaaaaaaaaaaaaaaaaaaaaaaaaaaaaaaaa"},{"tenant_id":"tenant-demo","project_id":"project-demo","source_record_id":"artifact-strategy-001","source_sha256":"aaaaaaaaaaaaaaaaaaaaaaaaaaaaaaaaaaaaaaaaaaaaaaaaaaaaaaaaaaaaaaaa"},{"tenant_id":"tenant-demo","project_id":"project-demo","source_record_id":"artifact-roadmap-001","source_sha256":"aaaaaaaaaaaaaaaaaaaaaaaaaaaaaaaaaaaaaaaaaaaaaaaaaaaaaaaaaaaaaaaa"},{"tenant_id":"tenant-demo","project_id":"project-demo","source_record_id":"publication-registry-demo","source_sha256":"aaaaaaaaaaaaaaaaaaaaaaaaaaaaaaaaaaaaaaaaaaaaaaaaaaaaaaaaaaaaaaaa"}],"files":[{"file_name":"projects.csv","relative_path":"notion-import/projects.csv","content_sha256":"aaaaaaaaaaaaaaaaaaaaaaaaaaaaaaaaaaaaaaaaaaaaaaaaaaaaaaaaaaaaaaaa","row_count":1},{"file_name":"tasks.csv","relative_path":"notion-import/tasks.csv","content_sha256":"aaaaaaaaaaaaaaaaaaaaaaaaaaaaaaaaaaaaaaaaaaaaaaaaaaaaaaaaaaaaaaaa","row_count":2},{"file_name":"assignments.csv","relative_path":"notion-import/assignments.csv","content_sha256":"aaaaaaaaaaaaaaaaaaaaaaaaaaaaaaaaaaaaaaaaaaaaaaaaaaaaaaaaaaaaaaaa","row_count":1},{"file_name":"artifacts.csv","relative_path":"notion-import/artifacts.csv","content_sha256":"aaaaaaaaaaaaaaaaaaaaaaaaaaaaaaaaaaaaaaaaaaaaaaaaaaaaaaaaaaaaaaaa","row_count":5},{"file_name":"reviews.csv","relative_path":"notion-import/reviews.csv","content_sha256":"aaaaaaaaaaaaaaaaaaaaaaaaaaaaaaaaaaaaaaaaaaaaaaaaaaaaaaaaaaaaaaaa","row_count":1},{"file_name":"approvals.csv","relative_path":"notion-import/approvals.csv","content_sha256":"aaaaaaaaaaaaaaaaaaaaaaaaaaaaaaaaaaaaaaaaaaaaaaaaaaaaaaaaaaaaaaaa","row_count":1},{"file_name":"blockers.csv","relative_path":"notion-import/blockers.csv","content_sha256":"aaaaaaaaaaaaaaaaaaaaaaaaaaaaaaaaaaaaaaaaaaaaaaaaaaaaaaaaaaaaaaaa","row_count":1},{"file_name":"priorities.csv","relative_path":"notion-import/priorities.csv","content_sha256":"aaaaaaaaaaaaaaaaaaaaaaaaaaaaaaaaaaaaaaaaaaaaaaaaaaaaaaaaaaaaaaaa","row_count":1},{"file_name":"deadlines.csv","relative_path":"notion-import/deadlines.csv","content_sha256":"aaaaaaaaaaaaaaaaaaaaaaaaaaaaaaaaaaaaaaaaaaaaaaaaaaaaaaaaaaaaaaaa","row_count":1},{"file_name":"relations.csv","relative_path":"notion-import/relations.csv","content_sha256":"aaaaaaaaaaaaaaaaaaaaaaaaaaaaaaaaaaaaaaaaaaaaaaaaaaaaaaaaaaaaaaaa","row_count":1},{"file_name":"performance-checkpoints.csv","relative_path":"notion-import/performance-checkpoints.csv","content_sha256":"aaaaaaaaaaaaaaaaaaaaaaaaaaaaaaaaaaaaaaaaaaaaaaaaaaaaaaaaaaaaaaaa","row_count":3},{"file_name":"IMPORT_ORDER.md","relative_path":"notion-import/IMPORT_ORDER.md","content_sha256":"aaaaaaaaaaaaaaaaaaaaaaaaaaaaaaaaaaaaaaaaaaaaaaaaaaaaaaaaaaaaaaaa","row_count":0},{"file_name":"PROPERTY_MAPPING.md","relative_path":"notion-import/PROPERTY_MAPPING.md","content_sha256":"aaaaaaaaaaaaaaaaaaaaaaaaaaaaaaaaaaaaaaaaaaaaaaaaaaaaaaaaaaaaaaaa","row_count":0},{"file_name":"USER_MAPPING_TEMPLATE.csv","relative_path":"notion-import/USER_MAPPING_TEMPLATE.csv","content_sha256":"aaaaaaaaaaaaaaaaaaaaaaaaaaaaaaaaaaaaaaaaaaaaaaaaaaaaaaaaaaaaaaaa","row_count":1}],"customer_rows":[{"external_id":"customer-demo","source_sha256":"aaaaaaaaaaaaaaaaaaaaaaaaaaaaaaaaaaaaaaaaaaaaaaaaaaaaaaaaaaaaaaaa"}],"project_rows":[{"external_id":"project-demo","customer_external_id":"customer-demo","tenant_id":"tenant-demo","project_id":"project-demo","source_sha256":"aaaaaaaaaaaaaaaaaaaaaaaaaaaaaaaaaaaaaaaaaaaaaaaaaaaaaaaaaaaaaaaa"}],"artifact_rows":[{"external_id":"artifact-strategy-001","project_external_id":"project-demo","tenant_id":"tenant-demo","project_id":"project-demo","content_sha256":"aaaaaaaaaaaaaaaaaaaaaaaaaaaaaaaaaaaaaaaaaaaaaaaaaaaaaaaaaaaaaaaa","revision":1,"relative_path":"strategy/a.json","role":"strategy","read_only":true},{"external_id":"artifact-architecture-001","project_external_id":"project-demo","tenant_id":"tenant-demo","project_id":"project-demo","content_sha256":"aaaaaaaaaaaaaaaaaaaaaaaaaaaaaaaaaaaaaaaaaaaaaaaaaaaaaaaaaaaaaaaa","revision":1,"relative_path":"architecture/a.json","role":"architecture","read_only":true},{"external_id":"artifact-roadmap-001","project_external_id":"project-demo","tenant_id":"tenant-demo","project_id":"project-demo","content_sha256":"aaaaaaaaaaaaaaaaaaaaaaaaaaaaaaaaaaaaaaaaaaaaaaaaaaaaaaaaaaaaaaaa","revision":1,"relative_path":"roadmap/a.json","role":"roadmap","read_only":true},{"external_id":"artifact-copywriter-001","project_external_id":"project-demo","tenant_id":"tenant-demo","project_id":"project-demo","content_sha256":"aaaaaaaaaaaaaaaaaaaaaaaaaaaaaaaaaaaaaaaaaaaaaaaaaaaaaaaaaaaaaaaa","revision":1,"relative_path":"copywriter-handoff/a.json","role":"copywriter","read_only":true},{"external_id":"artifact-developer-001","project_external_id":"project-demo","tenant_id":"tenant-demo","project_id":"project-demo","content_sha256":"aaaaaaaaaaaaaaaaaaaaaaaaaaaaaaaaaaaaaaaaaaaaaaaaaaaaaaaaaaaaaaaa","revision":1,"relative_path":"developer-handoff/a.json","role":"developer","read_only":true}],"review_rows":[{"external_id":"review-demo-0001","project_external_id":"project-demo","artifact_external_id":"artifact-copywriter-001","source_sha256":"aaaaaaaaaaaaaaaaaaaaaaaaaaaaaaaaaaaaaaaaaaaaaaaaaaaaaaaaaaaaaaaa","read_only":true}],"approval_rows":[{"external_id":"approval-demo-0001","project_external_id":"project-demo","artifact_external_id":"artifact-developer-001","source_sha256":"aaaaaaaaaaaaaaaaaaaaaaaaaaaaaaaaaaaaaaaaaaaaaaaaaaaaaaaaaaaaaaaa","read_only":true}],"blocker_rows":[{"external_id":"blocker-demo-0001","project_external_id":"project-demo","artifact_external_id":"artifact-roadmap-001","source_sha256":"aaaaaaaaaaaaaaaaaaaaaaaaaaaaaaaaaaaaaaaaaaaaaaaaaaaaaaaaaaaaaaaa","read_only":true}],"task_rows":[{"external_id":"task-core-0001","tenant_id":"tenant-demo","project_id":"project-demo","task_class":"core_history","title":"History","history_only":true},{"external_id":"task-implementation-0001","tenant_id":"tenant-demo","project_id":"project-demo","task_class":"notion_implementation","title":"Implement","status":"not_started","comments":"","assignee":"unassigned","priority":"high","deadline":"2026-09-01","core_effect":"none"}],"assignment_rows":[{"external_id":"assignment-demo-0001","task_external_id":"task-implementation-0001","assignee":"unassigned"}],"priority_rows":[{"task_external_id":"task-implementation-0001","value":"high"}],"deadline_rows":[{"task_external_id":"task-implementation-0001","value":"2026-09-01"}],"relations":[{"from_record_id":"project-demo","to_record_id":"task-implementation-0001","relation_type":"belongs_to"}],"performance_checkpoint_rows":[{"day_after_publication":30,"released_strategy_artifact_id":"artifact-strategy-001","released_plan_artifact_id":"artifact-roadmap-001","publication_registry_record_id":"publication-registry-demo","performance_data_status":"pending_verified_data"},{"day_after_publication":60,"released_strategy_artifact_id":"artifact-strategy-001","released_plan_artifact_id":"artifact-roadmap-001","publication_registry_record_id":"publication-registry-demo","performance_data_status":"pending_verified_data"},{"day_after_publication":90,"released_strategy_artifact_id":"artifact-strategy-001","released_plan_artifact_id":"artifact-roadmap-001","publication_registry_record_id":"publication-registry-demo","performance_data_status":"pending_verified_data"}],"unresolved_assignee_ids":["assignment-demo-0001"],"user_mapping_template_path":"notion-import/USER_MAPPING_TEMPLATE.csv","manifest_sha256":"aaaaaaaaaaaaaaaaaaaaaaaaaaaaaaaaaaaaaaaaaaaaaaaaaaaaaaaaaaaaaaaa","created_at":"2026-08-20T12:00:00Z"}
